text_metadata,text
"{""link"":""https://ciudadseva.com/texto/abel-y-cain-borges/"", ""title"": ""Abel y Caín"", ""metadata"": ""[Minicuento - Texto completo.]"", ""author"": ""Jorge Luis Borges""}","Abel y Caín se encontraron después de la muerte de Abel. Caminaban por el desierto y se reconocieron desde lejos, porque los dos eran muy altos. Los hermanos se sentaron en la tierra, hicieron un fuego y comieron. Guardaban silencio, a la manera de la gente cansada cuando declina el día. En el cielo asomaba alguna estrella, que aún no había recibido su nombre. A la luz de las llamas, Caín advirtió en la frente de Abel la marca de la piedra y dejó caer el pan que estaba por llevarse a la boca y pidió que le fuera perdonado su crimen. Abel contestó: —¿Tú me has matado o yo te he matado? Ya no recuerdo; aquí estamos juntos como antes. —Ahora sé que en verdad me has perdonado —dijo Caín—, porque olvidar es perdonar. Yo trataré también de olvidar. Abel dijo despacio: —Así es. Mientras dura el remordimiento dura la culpa. FIN"
"{""link"":""https://ciudadseva.com/texto/adrogue/"", ""title"": ""Adrogué"", ""metadata"": ""[Minicuento - Texto completo.]"", ""author"": ""Jorge Luis Borges""}","Era muy lindo, un pueblo laberíntico. A veces, algunas noches de verano, salíamos mi padre, mi madre y yo a perdernos. Al principio nos costaba un poco de trabajo, pero luego nos perfeccionamos tanto que nos perdíamos enseguida. FIN"
"{""link"":""https://ciudadseva.com/texto/alguien-sonara/"", ""title"": ""Alguien soñará"", ""metadata"": ""[Minicuento - Texto completo.]"", ""author"": ""Jorge Luis Borges""}","¿Qué soñará el indescifrable futuro? Soñará que Alonso Quijano puede ser don Quijote sin dejar su aldea y sus libros. Soñará que una víspera de Ulises puede ser más pródiga que el poema que narra sus trabajos. Soñará generaciones humanas que no reconocerán el nombre de Ulises. Soñará sueños más precisos que la vigilia de hoy. Soñará que podremos hacer milagros y que no los haremos, porque será más real imaginarlos. Soñará mundos tan intensos que la voz de una sola de sus aves podría matarte. Soñará que el olvido y la memoria pueden ser actos voluntarios, no agresiones o dádivas del azar. Soñará que veremos con todo el cuerpo, como quería Milton desde la sombra de esos tiernos orbes, los ojos. Soñará un mundo sin la máquina y sin esa doliente máquina, el cuerpo. La vida no es un sueño pero puede llegar a ser un sueño, escribe Novalis. FIN"
"{""link"":""https://ciudadseva.com/texto/andres-armoa/"", ""title"": ""Andrés Armoa"", ""metadata"": ""[Minicuento - Texto completo.]"", ""author"": ""Jorge Luis Borges""}","Los años le han dejado unas palabras en guaraní, que sabe usar cuando la ocasión lo requiere, pero que no podría traducir sin algún trabajo. Los otros soldados lo aceptan, pero algunos (no todos) sienten que algo ajeno hay en él, como si fuera hereje o infiel o padeciera un mal. Este rechazo lo fastidia menos que el interés de los reclutas. No es bebedor, pero suele achisparse los sábados. Tiene la costumbre del mate, que puebla de algún modo la soledad. Las mujeres no lo quieren y él no las busca. Tiene un hijo en Dolores. Hace años que no sabe nada de él, a la manera de la gente sencilla que no se escribe. No es hombre de buena conversación, pero suele contar, siempre con las mismas palabras, aquella larga marcha de tantas leguas desde Junín hasta San Carlos.Quizá la cuenta con las mismas palabras, porque las sabe de memoria y ha olvidado los hechos. No tiene catre. Duerme sobre el recado y no sabe qué cosa es la pesadilla. Tiene la conciencia tranquila. Se ha limitado a cumplir órdenes. Goza de la confianza de sus jefes. Es el degollador. Ha perdido la cuenta de las veces que ha visto el alba en el desierto. Ha perdido la cuenta de las gargantas, pero no olvidará la primera y los visajes que hizo el pampa. Nunca lo ascenderán. No debe llamar la atención. En su provincia fue domador. Ya es incapaz de jinetear un bagual, pero le gustan los caballos y los entiende. Es amigo de un indio. FIN"
"{""link"":""https://ciudadseva.com/texto/argumentum-ornithologicum/"", ""title"": ""Argumentum ornithologicum"", ""metadata"": ""[Minicuento - Texto completo.]"", ""author"": ""Jorge Luis Borges""}","Cierro los ojos y veo una bandada de pájaros. La visión dura un segundo o acaso menos; no sé cuántos pájaros vi. ¿Era definido o indefinido su número? El problema involucra el de la existencia de Dios. Si Dios existe, el número es definido, porque Dios sabe cuántos pájaros vi. Si Dios no existe, el número es indefinido, porque nadie pudo llevar la cuenta. En tal caso, vi menos de diez pájaros (digamos) y más de uno, pero no vi nueve, ocho, siete, seis, cinco, cuatro, tres o dos pájaros. Vi un número entre diez y uno, que no es nueve, ocho, siete, seis, cinco, etcétera. Ese número entero es inconcebible; ergo, Dios existe. FIN"
